{
  "$schema": "https://json-schema.org/draft/2020-12/schema",
  "$id": "https://install.katl.dev/schemas/install-manifest-v1alpha1.schema.json",
  "title": "Katl install manifest v1alpha1",
  "type": "object",
  "additionalProperties": false,
  "required": [
    "apiVersion",
    "kind",
    "node",
    "install",
    "katlosImage"
  ],
  "properties": {
    "apiVersion": {
      "const": "install.katl.dev/v1alpha1"
    },
    "kind": {
      "const": "InstallManifest"
    },
    "node": {
      "type": "object",
      "additionalProperties": false,
      "required": [
        "identity"
      ],
      "properties": {
        "identity": {
          "type": "object",
          "additionalProperties": false,
          "required": [
            "hostname",
            "ssh"
          ],
          "properties": {
            "hostname": {
              "$ref": "#/$defs/dnsLabel"
            },
            "ssh": {
              "type": "object",
              "additionalProperties": false,
              "required": [
                "authorizedKeys"
              ],
              "properties": {
                "authorizedKeys": {
                  "type": "array",
                  "minItems": 1,
                  "uniqueItems": true,
                  "items": {
                    "$ref": "#/$defs/sshAuthorizedKey"
                  }
                }
              }
            }
          }
        },
        "networkd": {
          "$ref": "#/$defs/networkdConfig"
        },
        "kubernetes": {
          "$ref": "#/$defs/kubernetesConfig"
        }
      }
    },
    "install": {
      "type": "object",
      "additionalProperties": false,
      "required": [
        "allowDestructiveInstall",
        "targetDisk"
      ],
      "properties": {
        "allowDestructiveInstall": {
          "description": "Must be explicitly true before katlos-install may wipe or repartition the target root disk.",
          "const": true
        },
        "targetDisk": {
          "$ref": "#/$defs/diskSelector"
        },
        "extraDisks": {
          "type": "array",
          "default": [],
          "uniqueItems": true,
          "items": {
            "$ref": "#/$defs/extraDisk"
          }
        }
      }
    },
    "katlosImage": {
      "type": "object",
      "additionalProperties": false,
      "required": [
        "sha256",
        "sizeBytes",
        "version",
        "architecture",
        "role"
      ],
      "properties": {
        "url": {
          "type": "string",
          "format": "uri",
          "pattern": "^[A-Za-z][A-Za-z0-9+.-]*://[^/\\s]+.*$"
        },
        "localRef": {
          "$ref": "#/$defs/relativePath"
        },
        "sha256": {
          "$ref": "#/$defs/sha256"
        },
        "sizeBytes": {
          "type": "integer",
          "minimum": 1
        },
        "version": {
          "$ref": "#/$defs/nonEmptyString"
        },
        "architecture": {
          "$ref": "#/$defs/nonEmptyString"
        },
        "runtimeInterface": {
          "$ref": "#/$defs/nonEmptyString"
        },
        "role": {
          "const": "install"
        }
      },
      "oneOf": [
        {
          "required": [
            "url"
          ],
          "not": {
            "required": [
              "localRef"
            ]
          }
        },
        {
          "required": [
            "localRef"
          ],
          "not": {
            "required": [
              "url"
            ]
          }
        }
      ]
    }
  },
  "$defs": {
    "diskSelector": {
      "type": "object",
      "additionalProperties": false,
      "properties": {
        "byID": {
          "type": "string",
          "pattern": "^/dev/disk/by-id/[^/]+$"
        },
        "wwn": {
          "type": "string",
          "minLength": 1
        },
        "serial": {
          "type": "string",
          "minLength": 1
        },
        "minSizeMiB": {
          "type": "integer",
          "minimum": 8192
        }
      },
      "oneOf": [
        {
          "required": [
            "byID"
          ]
        },
        {
          "required": [
            "wwn"
          ]
        },
        {
          "required": [
            "serial"
          ]
        }
      ]
    },
    "dnsLabel": {
      "type": "string",
      "minLength": 1,
      "maxLength": 63,
      "pattern": "^[a-z0-9]([-a-z0-9]*[a-z0-9])?$"
    },
    "extraDisk": {
      "type": "object",
      "additionalProperties": false,
      "required": [
        "name",
        "selector",
        "filesystem",
        "mount"
      ],
      "properties": {
        "name": {
          "$ref": "#/$defs/dnsLabel"
        },
        "selector": {
          "$ref": "#/$defs/diskSelector"
        },
        "filesystem": {
          "enum": [
            "ext4",
            "xfs"
          ]
        },
        "mount": {
          "type": "object",
          "additionalProperties": false,
          "required": [
            "path"
          ],
          "properties": {
            "path": {
              "type": "string",
              "pattern": "^/(srv|var/lib/katl/extra)/[A-Za-z0-9._-]+(/[A-Za-z0-9._-]+)*$"
            }
          }
        },
        "wipe": {
          "type": "boolean",
          "default": false
        }
      }
    },
    "kubeadmReference": {
      "type": "object",
      "additionalProperties": false,
      "properties": {
        "configRef": {
          "$ref": "#/$defs/dnsLabel"
        }
      }
    },
    "kubernetesConfig": {
      "type": "object",
      "additionalProperties": false,
      "properties": {
        "kubeadm": {
          "$ref": "#/$defs/kubeadmReference"
        }
      }
    },
    "nonEmptyString": {
      "type": "string",
      "minLength": 1
    },
    "relativePath": {
      "type": "string",
      "pattern": "^(?!.*(^|/)\\.\\.?($|/))[A-Za-z0-9._+-]+(/[A-Za-z0-9._+-]+)*$"
    },
    "networkdConfig": {
      "type": "object",
      "additionalProperties": false,
      "properties": {
        "files": {
          "type": "array",
          "default": [],
          "uniqueItems": true,
          "items": {
            "$ref": "#/$defs/networkdFile"
          }
        }
      }
    },
    "networkdFile": {
      "type": "object",
      "additionalProperties": false,
      "required": [
        "name",
        "content"
      ],
      "properties": {
        "name": {
          "type": "string",
          "pattern": "^[A-Za-z0-9._@+-]+\\.(network|netdev|link)$"
        },
        "content": {
          "type": "string",
          "minLength": 1,
          "pattern": "\\S"
        }
      }
    },
    "sha256": {
      "type": "string",
      "pattern": "^[0-9a-f]{64}$"
    },
    "sshAuthorizedKey": {
      "type": "string",
      "pattern": "^(ssh-ed25519|ssh-rsa|ecdsa-sha2-nistp256|sk-ssh-ed25519@openssh.com) [A-Za-z0-9+/=]+( .*)?$"
    }
  }
}
