{
  "apiVersion": "install.katl.dev/v1alpha1",
  "kind": "InstallManifest",
  "node": {
    "identity": {
      "hostname": "lab-node-01",
      "ssh": {
        "authorizedKeys": [
          "ssh-ed25519 AAAAC3NzaC1lZDI1NTE5AAAAIKatlExampleRuntimeKeyReplaceMe katl@example"
        ]
      }
    }
  },
  "install": {
    "allowDestructiveInstall": true,
    "targetDisk": {
      "byID": "/dev/disk/by-id/ata-KATL_EXAMPLE_ROOT_DISK",
      "minSizeMiB": 32768
    }
  },
  "katlosImage": {
    "url": "https://artifacts.example.invalid/katl/katlos-install-2026.06.04-x86_64.squashfs",
    "sha256": "aaaaaaaaaaaaaaaaaaaaaaaaaaaaaaaaaaaaaaaaaaaaaaaaaaaaaaaaaaaaaaaa",
    "sizeBytes": 1073741824,
    "version": "2026.06.04",
    "architecture": "x86_64",
    "runtimeInterface": "katl-runtime-1",
    "role": "install"
  }
}
